{
  "id": "urn:ngsi-ld:AEDLocation:131016-131016A00001",
  "type": "AEDLocation",
  "name": "千代田区役所",
  "nameKana": "チヨダクヤクショ",
  "externalFacilityId": "131016A00001",
  "localGovernmentCode": "131016",
  "address": {
    "addressCountry": "JP",
    "addressRegion": "東京都",
    "addressLocality": "千代田区",
    "machiaza": "九段南",
    "chome": "1",
    "banchi": "2",
    "go": "1",
    "localGovernmentCode": "131016",
    "addressText": "東京都千代田区九段南1丁目2番1号"
  },
  "location": {
    "type": "Point",
    "coordinates": [
      139.75354,
      35.693947
    ]
  },
  "installationLocation": "1階 総合案内",
  "operatorName": "千代田区",
  "corporateNumber": "8000020131016",
  "contactPoint": {
    "telephone": "03-3264-2111"
  },
  "openingHoursSpecification": {
    "dayOfWeek": [
      "Monday",
      "Tuesday",
      "Wednesday",
      "Thursday",
      "Friday"
    ],
    "opens": "08:30",
    "closes": "17:00",
    "description": "千代田区役所の開庁時間に従う。"
  },
  "pediatricSupport": true,
  "restrictedAccess": false
}
